### ISSUE TITLE
/debug/ how to disable.. and doh vs 53

### ISSUE THREAD

**Issue by bcookatpcsd** [0xERR0R/blocky#688]
I've setup blocky as a doh endpoint and pushed it as the resolver for < 10k chromebooks.. 

Used certbot to make the cert, and it defaulted to the ISRG Root X1.. (fwiw) 

when visiting the doh url a 'download' file is presented which contains html about /debug/ and the contents of debug/pprof/

(1) how do I disable /debug/ ? 

(2) and is there an entry that I can use to see if the query was a doh request or not?

(3) anyway to block version.bind answers? 

@40000000634f22160e76eb44  INFO queryLog: query resolved answer=A (38.88.8.34), A (35.202.119.40) client_ip=167.94.138.109 client_names=167.94.138.109 duration_ms=63 question=A (ip.parrotdns.com.) response_code=NOERROR response_reason=RESOLVED (https://doh.cleanbrowsing.org/doh/custom-filter/8<snip>8/)
@40000000634f2216152ec09c  INFO queryLog: query resolved answer=A (38.88.8.34), A (35.202.119.40) client_ip=167.94.138.63 client_names=167.94.138.63 duration_ms=0 question=A (ip.parrotdns.com.) response_code=NOERROR response_reason=CACHED
@40000000634f22161765400c  INFO queryLog: query resolved answer=version.bind.   9600    CH      TXT     "CleanBrowsing v1.6a - dns-edge-usa-east-newyork-c" client_ip=167.94.138.63 client_names=167.94.138.63 duration_ms=8 question=TXT (version.bind.) response_code=NOERROR response_reason=RESOLVED (https://doh.cleanbrowsing.org/doh/custom-filter/8<snip>8/)

(4) any possible way to debug what these might be.. and fix them.. 
@40000000634f223e325955ec 2022/10/18 18:01:24 http: TLS handshake error from 216.179.118.34:36954: EOF
@40000000634f223e34145fe4 2022/10/18 18:01:24 http: TLS handshake error from 216.179.118.34:36958: EOF
@40000000634f223e34957aac 2022/10/18 18:01:24 http: TLS handshake error from 216.179.118.34:36950: EOF
@40000000634f223e3b24f7e4 2022/10/18 18:01:24 http: TLS handshake error from 216.179.118.34:36956: EOF
@40000000634f225a20bb6ec4 2022/10/18 18:01:52 http: TLS handshake error from 173.77.42.207:37914: EOF
@40000000634f225a20bc4984 2022/10/18 18:01:52 http: TLS handshake error from 173.77.42.207:37920: EOF
@40000000634f227e1438624c 2022/10/18 18:02:28 http: TLS handshake error from 24.168.34.242:46246: EOF

(version) 
blocky
Version: a452c1b
Build time: 20221018-181232
go version go1.19.2 linux/amd64
build on void linux libc 

I need to fix the log/run to remove the timestamp.. 

as always, thank you in advance.

**Comment by bcookatpcsd** [comment]
pcap of the tls.. should it help.. 

```
  225 0.871339565   10.20.0.15 → 24.168.38.30 TCP 74 443 → 42002 [SYN, ACK] Seq=0 Ack=1 Win=43440 Len=0 MSS=1460 SACK_PERM TSval=659663675 TSecr=3059642510 WS=512
  226 0.871428687 24.168.38.30 → 10.20.0.15   TCP 74 42006 → 443 [SYN] Seq=0 Win=64240 Len=0 MSS=1460 SACK_PERM TSval=3059642513 TSecr=0 WS=128
  227 0.871442599   10.20.0.15 → 24.168.38.30 TCP 74 443 → 42006 [SYN, ACK] Seq=0 Ack=1 Win=43440 Len=0 MSS=1460 SACK_PERM TSval=659663675 TSecr=3059642513 WS=512
  228 0.871468674 24.168.38.30 → 10.20.0.15   TCP 74 42010 → 443 [SYN] Seq=0 Win=64240 Len=0 MSS=1460 SACK_PERM TSval=3059642514 TSecr=0 WS=128
  229 0.871479207   10.20.0.15 → 24.168.38.30 TCP 74 443 → 42010 [SYN, ACK] Seq=0 Ack=1 Win=43440 Len=0 MSS=1460 SACK_PERM TSval=659663675 TSecr=3059642514 WS=512
  230 0.871872575 24.168.38.30 → 10.20.0.15   TCP 74 42004 → 443 [SYN] Seq=0 Win=64240 Len=0 MSS=1460 SACK_PERM TSval=3059642513 TSecr=0 WS=128
  231 0.871922552   10.20.0.15 → 24.168.38.30 TCP 74 443 → 42004 [SYN, ACK] Seq=0 Ack=1 Win=43440 Len=0 MSS=1460 SACK_PERM TSval=659663675 TSecr=3059642513 WS=512
  232 0.871954402 24.168.38.30 → 10.20.0.15   TCP 74 42008 → 443 [SYN] Seq=0 Win=64240 Len=0 MSS=1460 SACK_PERM TSval=3059642513 TSecr=0 WS=128
  233 0.871968149   10.20.0.15 → 24.168.38.30 TCP 74 443 → 42008 [SYN, ACK] Seq=0 Ack=1 Win=43440 Len=0 MSS=1460 SACK_PERM TSval=659663675 TSecr=3059642513 WS=512
  235 0.876391680 24.168.38.30 → 10.20.0.15   TCP 74 42014 → 443 [SYN] Seq=0 Win=64240 Len=0 MSS=1460 SACK_PERM TSval=3059642519 TSecr=0 WS=128
  236 0.876407122   10.20.0.15 → 24.168.38.30 TCP 74 443 → 42014 [SYN, ACK] Seq=0 Ack=1 Win=43440 Len=0 MSS=1460 SACK_PERM TSval=659663680 TSecr=3059642519 WS=512
  237 0.876446469 24.168.38.30 → 10.20.0.15   TCP 74 42012 → 443 [SYN] Seq=0 Win=64240 Len=0 MSS=1460 SACK_PERM TSval=3059642519 TSecr=0 WS=128
  238 0.876463844   10.20.0.15 → 24.168.38.30 TCP 74 443 → 42012 [SYN, ACK] Seq=0 Ack=1 Win=43440 Len=0 MSS=1460 SACK_PERM TSval=659663680 TSecr=3059642519 WS=512
  269 0.930910710 24.168.38.30 → 10.20.0.15   TCP 66 42002 → 443 [ACK] Seq=1 Ack=1 Win=64256 Len=0 TSval=3059642547 TSecr=659663675
  273 0.941119612 24.168.38.30 → 10.20.0.15   TCP 66 42006 → 443 [ACK] Seq=1 Ack=1 Win=64256 Len=0 TSval=3059642547 TSecr=659663675
  274 0.941188639 24.168.38.30 → 10.20.0.15   TCP 66 42010 → 443 [ACK] Seq=1 Ack=1 Win=64256 Len=0 TSval=3059642547 TSecr=659663675
  275 0.941584507 24.168.38.30 → 10.20.0.15   TCP 66 42008 → 443 [ACK] Seq=1 Ack=1 Win=64256 Len=0 TSval=3059642547 TSecr=659663675
  276 0.941584577 24.168.38.30 → 10.20.0.15   TCP 66 42004 → 443 [ACK] Seq=1 Ack=1 Win=64256 Len=0 TSval=3059642547 TSecr=659663675
  277 0.946524328 24.168.38.30 → 10.20.0.15   TLSv1 583 Client Hello
  278 0.946563610   10.20.0.15 → 24.168.38.30 TCP 66 443 → 42002 [ACK] Seq=1 Ack=518 Win=43008 Len=0 TSval=659663750 TSecr=3059642582
  279 0.946710242 24.168.38.30 → 10.20.0.15   TLSv1 583 Client Hello
  280 0.946727674   10.20.0.15 → 24.168.38.30 TCP 66 443 → 42010 [ACK] Seq=1 Ack=518 Win=43008 Len=0 TSval=659663750 TSecr=3059642575
  281 0.947144927 24.168.38.30 → 10.20.0.15   TCP 66 42014 → 443 [ACK] Seq=1 Ack=1 Win=64256 Len=0 TSval=3059642584 TSecr=659663680
  282 0.947186002 24.168.38.30 → 10.20.0.15   TCP 66 42012 → 443 [ACK] Seq=1 Ack=1 Win=64256 Len=0 TSval=3059642584 TSecr=659663680
  283 0.947344179 24.168.38.30 → 10.20.0.15   TLSv1 583 Client Hello
  284 0.947361161   10.20.0.15 → 24.168.38.30 TCP 66 443 → 42006 [ACK] Seq=1 Ack=518 Win=43008 Len=0 TSval=659663751 TSecr=3059642590
  286 0.947496760 24.168.38.30 → 10.20.0.15   TLSv1 583 Client Hello
  287 0.947510323   10.20.0.15 → 24.168.38.30 TCP 66 443 → 42012 [ACK] Seq=1 Ack=518 Win=43008 Len=0 TSval=659663751 TSecr=3059642591
  288 0.947655677 24.168.38.30 → 10.20.0.15   TLSv1 583 Client Hello
  289 0.947655752 24.168.38.30 → 10.20.0.15   TLSv1 583 Client Hello
  290 0.947670989   10.20.0.15 → 24.168.38.30 TCP 66 443 → 42004 [ACK] Seq=1 Ack=518 Win=43008 Len=0 TSval=659663751 TSecr=3059642582
  291 0.947693874   10.20.0.15 → 24.168.38.30 TCP 66 443 → 42008 [ACK] Seq=1 Ack=518 Win=43008 Len=0 TSval=659663751 TSecr=3059642588
  292 0.951170395 24.168.38.30 → 10.20.0.15   TLSv1 583 Client Hello
  293 0.951188034   10.20.0.15 → 24.168.38.30 TCP 66 443 → 42014 [ACK] Seq=1 Ack=518 Win=43008 Len=0 TSval=659663754 TSecr=3059642592
  294 0.956322721   10.20.0.15 → 24.168.38.30 TLSv1.3 1514 Server Hello, Change Cipher Spec, Application Data
  295 0.956340904   10.20.0.15 → 24.168.38.30 TCP 1514 443 → 42002 [PSH, ACK] Seq=1449 Ack=518 Win=43008 Len=1448 TSval=659663760 TSecr=3059642582 [TCP segment of a reassembled PDU]
  296 0.956356569   10.20.0.15 → 24.168.38.30 TLSv1.3 1514 Application Data
  297 0.956371391   10.20.0.15 → 24.168.38.30 TLSv1.3 461 Application Data, Application Data, Application Data
  300 0.964926378   10.20.0.15 → 24.168.38.30 TLSv1.3 1514 Server Hello, Change Cipher Spec, Application Data
  301 0.964945058   10.20.0.15 → 24.168.38.30 TCP 1514 443 → 42012 [PSH, ACK] Seq=1449 Ack=518 Win=43008 Len=1448 TSval=659663768 TSecr=3059642591 [TCP segment of a reassembled PDU]
  302 0.964959478   10.20.0.15 → 24.168.38.30 TLSv1.3 1514 Application Data
  303 0.964975341   10.20.0.15 → 24.168.38.30 TLSv1.3 461 Application Data, Application Data, Application Data
  304 0.965445603   10.20.0.15 → 24.168.38.30 TLSv1.3 1514 Server Hello, Change Cipher Spec, Application Data
  305 0.965466963   10.20.0.15 → 24.168.38.30 TCP 1514 443 → 42008 [PSH, ACK] Seq=1449 Ack=518 Win=43008 Len=1448 TSval=659663769 TSecr=3059642588 [TCP segment of a reassembled PDU]
  306 0.965482753   10.20.0.15 → 24.168.38.30 TLSv1.3 1514 Application Data
  307 0.965497736   10.20.0.15 → 24.168.38.30 TLSv1.3 461 Application Data, Application Data, Application Data
  308 0.973486011   10.20.0.15 → 24.168.38.30 TLSv1.3 1514 Server Hello, Change Cipher Spec, Application Data
  309 0.973510831   10.20.0.15 → 24.168.38.30 TCP 1514 443 → 42010 [PSH, ACK] Seq=1449 Ack=518 Win=43008 Len=1448 TSval=659663777 TSecr=3059642575 [TCP segment of a reassembled PDU]
  310 0.973527306   10.20.0.15 → 24.168.38.30 TLSv1.3 1514 Application Data
  311 0.973542336   10.20.0.15 → 24.168.38.30 TLSv1.3 461 Application Data, Application Data, Application Data
  312 0.978415844   10.20.0.15 → 24.168.38.30 TLSv1.3 1514 Server Hello, Change Cipher Spec, Application Data
  313 0.978436649   10.20.0.15 → 24.168.38.30 TCP 1514 443 → 42004 [PSH, ACK] Seq=1449 Ack=518 Win=43008 Len=1448 TSval=659663782 TSecr=3059642582 [TCP segment of a reassembled PDU]
  314 0.978452454   10.20.0.15 → 24.168.38.30 TLSv1.3 1514 Application Data
  315 0.978467341   10.20.0.15 → 24.168.38.30 TLSv1.3 461 Application Data, Application Data, Application Data
  318 0.981848527   10.20.0.15 → 24.168.38.30 TLSv1.3 1514 Server Hello, Change Cipher Spec, Application Data
  319 0.981868574   10.20.0.15 → 24.168.38.30 TCP 1514 443 → 42014 [PSH, ACK] Seq=1449 Ack=518 Win=43008 Len=1448 TSval=659663785 TSecr=3059642592 [TCP segment of a reassembled PDU]
  320 0.981883091   10.20.0.15 → 24.168.38.30 TLSv1.3 1514 Application Data
```

**Comment by bcookatpcsd** [comment]
It looks as if the doh uri wasn't saved correctly.. and this is what was/is causing the EOF issues.. 

https://your.name.here/dns-query

the dns-query path was somehow removed.. 

after fixing that and pushing the update.. the EOFs have resolved..

**Comment by 0xERR0R** [comment]
> I've setup blocky as a doh endpoint and pushed it as the resolver for < 10k chromebooks..
> 
> Used certbot to make the cert, and it defaulted to the ISRG Root X1.. (fwiw)
> 
> when visiting the doh url a 'download' file is presented which contains html about /debug/ and the contents of debug/pprof/
> 
> (1) how do I disable /debug/ ?

pprof is enable by default if http port is defined.

> 
> (2) and is there an entry that I can use to see if the query was a doh request or not?

No, you can't distinguish if it was a plain DNS request or a DoT/Doh.
> 
> (3) anyway to block version.bind answers?

You can put "version.bind" on a blacklist.
