### ISSUE TITLE
Android looks for tcp-tls on connect..

### ISSUE THREAD

**Issue by bcookatpcsd** [0xERR0R/blocky#1085]
```
11:02:20.954784 ARP, Request who-has 192.168.48.1 tell 192.168.48.105, length 42
11:02:20.960014 IP 192.168.48.105.33078 > 10.20.0.6.853: tcp 0
11:02:21.004649 IP 192.168.48.105.43106 > 10.20.0.6.53: UDP, length 47
11:02:21.004844 IP 192.168.48.105.43071 > 10.20.0.6.53: UDP, length 32
```

Android phone connecting to the network.. first looks for DoT.. 

https://source.android.com/docs/security/overview/reports/Google_Android_Enterprise_Security_Whitepaper_2020.pdf

Around page 27 or 31 in the page count.. 

Do you know if tries to verify the ca.. could you just offer an unsigned and it work? 

(will try later.. was working on something else and saw this.. )
